{
  "$schema": "https://json-schema.org/draft/2020-12/schema",
  "$id": "unknown-object.schema.json",
  "title": "Unknown Object",
  "description": "First-class unknown. An unknown stays visible until resolution evidence is recorded. It is not a confidence score and it does not authorize a decision.",
  "type": "object",
  "additionalProperties": false,
  "properties": {
    "schema_version": {
      "type": "string",
      "const": "1.0.0",
      "minLength": 1
    },
    "unknown_id": {
      "type": "string",
      "minLength": 1
    },
    "subject_id": {
      "type": "string",
      "minLength": 1
    },
    "configuration_digest": {
      "type": "string",
      "pattern": "^sha256:[a-f0-9]{64}$"
    },
    "statement": {
      "type": "string",
      "minLength": 1
    },
    "type": {
      "type": "string",
      "enum": [
        "ASSUMPTION",
        "UNANSWERED_QUESTION",
        "CONTRADICTION",
        "UNTESTED_DEPENDENCY",
        "UNAVAILABLE_INFORMATION",
        "UNCERTAIN_INFERENCE"
      ],
      "minLength": 1
    },
    "decision_relevance": {
      "type": "string",
      "minLength": 1
    },
    "blocking": {
      "type": "boolean"
    },
    "owner": {
      "type": "string",
      "minLength": 1
    },
    "identified_at": {
      "type": "string",
      "pattern": "^\\d{4}-\\d{2}-\\d{2}T\\d{2}:\\d{2}:\\d{2}Z$"
    },
    "resolution_evidence_refs": {
      "type": "array",
      "items": {
        "type": "string",
        "minLength": 1
      }
    },
    "status": {
      "type": "string",
      "enum": [
        "OPEN",
        "RESOLVED",
        "ACCEPTED"
      ],
      "minLength": 1
    },
    "revalidation_trigger": {
      "type": "string",
      "minLength": 1
    },
    "reference_only": {
      "type": "boolean",
      "const": true
    },
    "authority_effect": {
      "type": "string",
      "const": "NONE",
      "minLength": 1
    }
  },
  "required": [
    "schema_version",
    "unknown_id",
    "subject_id",
    "configuration_digest",
    "statement",
    "type",
    "decision_relevance",
    "blocking",
    "owner",
    "identified_at",
    "resolution_evidence_refs",
    "status",
    "revalidation_trigger",
    "reference_only",
    "authority_effect"
  ]
}
